{
  "ended_at": "2026-09-29T12:00:07Z",
  "profile_id": "stub-run-a",
  "results": [
    {
      "control_id": "ac-2",
      "ended_at": "2026-09-29T12:00:02Z",
      "evidence_refs": [
        "309e41d5e149b02d9e867c08000fd3d769c0206d0237a69d9ce801ec1e9361b7"
      ],
      "method": "inspect",
      "observations": [
        {
          "evidence_refs": [
            "309e41d5e149b02d9e867c08000fd3d769c0206d0237a69d9ce801ec1e9361b7"
          ],
          "subjects": [
            "arn:aws:s3:::stub-ac-2"
          ],
          "summary": "Stub check of arn:aws:s3:::stub-ac-2 met the expected state."
        }
      ],
      "started_at": "2026-09-29T12:00:01Z",
      "status": "pass",
      "tool_version": "0.0.0"
    },
    {
      "control_id": "ac-6",
      "ended_at": "2026-09-29T12:00:04Z",
      "evidence_refs": [
        "df87044d8e187bdddfc82707704de2debb5aa59261585216341296c83a6f341f"
      ],
      "method": "simulate",
      "observations": [
        {
          "evidence_refs": [
            "df87044d8e187bdddfc82707704de2debb5aa59261585216341296c83a6f341f"
          ],
          "subjects": [
            "arn:aws:s3:::stub-ac-6"
          ],
          "summary": "Stub check of arn:aws:s3:::stub-ac-6 did not meet the expected state."
        }
      ],
      "started_at": "2026-09-29T12:00:03Z",
      "status": "fail",
      "tool_version": "0.0.0"
    },
    {
      "control_id": "sc-13",
      "ended_at": "2026-09-29T12:00:06Z",
      "evidence_refs": [],
      "method": "exercise",
      "observations": [
        {
          "evidence_refs": [],
          "subjects": [],
          "summary": "Stub check raised an error before any evidence was collected."
        }
      ],
      "started_at": "2026-09-29T12:00:05Z",
      "status": "error",
      "tool_version": "0.0.0"
    }
  ],
  "run_id": "20260929T120000Z",
  "schema_version": "1.0.0",
  "started_at": "2026-09-29T12:00:00Z",
  "tool_version": "0.0.0"
}
